<?xml version="1.0" encoding="UTF-8"?>
<!-- Copyright DASSAULT SYSTEMES 2013 -->
<Config version="2.0" xmlns="DS_DELPPWConfiguration" xmlns:xsi="http://www.w3.org/2001/XMLSchema-instance" xsi:schemaLocation="DS_DELPPWConfiguration ../xsd/ExportCSVPreferences.xsd" Title="ExportCSV preferences" Description="Sample configuration file delivered by DS.">
  <Preferences>
    <ExportCSV showOptionPanel="false" defaultValue="false">
      <Type name="DELLmiGeneralSystemReference">
                <Attribute name="V_Name" dicoType="PLMEntity"/>
                <Attribute name="V_description" dicoType="PLMEntity"/>
            </Type>
            <Type name="DELLmiGeneralOperationReference">
                <Attribute name="V_Name" dicoType="PLMEntity"/>
                <Attribute name="V_description" dicoType="PLMEntity"/>
            </Type>
    </ExportCSV>
  </Preferences>
</Config>
